{
  "$schema": "https://json-schema.org/draft/2020-12/schema",
  "$id": "https://raw.githubusercontent.com/navikt/copilot/main/cli/nav-pilot/schemas/agentpakke-v1.json",
  "title": "nav-pilot agentpakke manifest (v1)",
  "description": "Contract between an agentpakke repo and the nav-pilot binary. Lives at .nav-pilot/agentpakke.json in the agentpakke repo. Unknown client keys, context keys, and additional fields are ignored by consumers (A3/A4), so growth of the ecosystem never invalidates an existing manifest on an older binary. Parenthesised ids such as (A1) and (G3) are decision ids defined in the PRD at https://github.com/navikt/copilot/issues/435.",
  "type": "object",
  "required": ["contractVersion", "name", "description", "clients"],
  "additionalProperties": true,
  "$defs": {
    "identifier": {
      "type": "string",
      "pattern": "^[a-z][a-z0-9-]*$"
    },
    "mcpServerName": {
      "description": "Name of a server in Nav's MCP registry (https://mcp-registry.nav.no), in the registry's own reverse-DNS form: <namespace>/<name>, as in io.github.navikt/github-mcp. The pattern is the registry's own name format and constrains the shape only. Membership is checked against the live registry when nav-pilot validates or installs, because the registry moves independently of nav-pilot releases: a list frozen into the schema would reject a server added after this version shipped.",
      "type": "string",
      "pattern": "^[a-zA-Z0-9][a-zA-Z0-9.-]*/[a-zA-Z0-9][a-zA-Z0-9._-]*$"
    },
    "relativePath": {
      "description": "Repo-relative path. Absolute paths and parent traversal are rejected by nav-pilot's semantic validation.",
      "type": "string",
      "minLength": 1
    },
    "privateDomain": {
      "description": "One DNS name whose lookup resolves to a private address, named in full and one at a time. No scheme, no port, no path, no wildcard. Each label is bounded at 63 characters and the whole name at 253, so a string the manifest accepts is one DNS can actually resolve.",
      "type": "string",
      "maxLength": 253,
      "pattern": "^[a-z0-9]([a-z0-9-]{0,61}[a-z0-9])?(\\.[a-z0-9]([a-z0-9-]{0,61}[a-z0-9])?)+$"
    },
    "proposedReadPath": {
      "description": "One file under the installing user's home directory, written \"~/\"-relative and named in full. nav-pilot expands the \"~\" at launch — the same leading-\"~/\" form cplt's own expand_tilde accepts — and passes the resolved absolute path as --allow-read. It must name a file, never a directory: cplt grants a subpath, so a directory hands over everything beneath it, and ~/Library/Application Support/naisdevice is one character away from handing over private.key. The pattern demands a final component with a name and an extension, which is what refuses a trailing separator and a bare directory name. nav-pilot refuses the rest semantically, because a schema cannot: \"..\" traversal after expansion, and any path at or under cplt's own DENIED_DOTFILES, DENIED_FILES or DENIED_HOME_SUBPATHS.",
      "type": "string",
      "minLength": 5,
      "maxLength": 256,
      "pattern": "^~/([^/\\\\\\p{Cc}\\p{Cf}\\p{Zl}\\p{Zp}]+/)*[^/\\\\.\\p{Cc}\\p{Cf}\\p{Zl}\\p{Zp}][^/\\\\\\p{Cc}\\p{Cf}\\p{Zl}\\p{Zp}]*\\.[^/\\\\.\\p{Cc}\\p{Cf}\\p{Zl}\\p{Zp}]+$"
    },
    "cpltProposalReason": {
      "description": "Why this agentpakke needs the waiver, in one or two sentences. It is rendered into the consent prompt, so it is the only thing the person deciding has to go on — and for the same reason it is bounded and may not carry control characters, escape sequences, line breaks or bidi overrides, which would let a pakke forge lines that look like nav-pilot's own. Ordinary prose is unaffected; nav-pilot collapses whitespace and refuses the rest at the point of printing as well.",
      "type": "string",
      "minLength": 1,
      "maxLength": 400,
      "pattern": "^[^\\p{Cc}\\p{Cf}\\p{Zl}\\p{Zp}]+$"
    },
    "cpltProposal": {
      "description": "Sandbox configuration proposed in cplt's own vocabulary. v1 defines two proposable settings. proxy.allow_private_domains is a DNS-rebinding waiver naming hosts one at a time: not a permission — the allowlist and the blocklist still apply, no port is opened, no path is granted, nothing is executed. allow.read grants read-only access to named files, one cplt rule per file and nothing else: no write, no bind, no outbound. Everything a repo must never propose (preset, allow.write, allow.exec, allow.socket, deny, repo_dirs, inherit_env, allowed_domains, blocked_domains, proxy.forced, the guards) is refused here rather than ignored. Other keys are tolerated for forward compatibility, but nav-pilot reports them as inert and never honours them.",
      "type": "object",
      "required": ["reason"],
      "additionalProperties": true,
      "propertyNames": {
        "description": "A cplt configuration key: lowercase, snake_case, bounded. Unknown keys stay legal for forward compatibility, but nav-pilot names them in the install warning, so a key name is untrusted text on its way to a terminal and is constrained like one.",
        "type": "string",
        "pattern": "^[a-z][a-z0-9_.]{0,63}$"
      },
      "properties": {
        "reason": { "$ref": "#/$defs/cpltProposalReason" },
        "proxy": {
          "type": "object",
          "additionalProperties": false,
          "properties": {
            "allow_private_domains": {
              "type": "array",
              "minItems": 1,
              "maxItems": 32,
              "uniqueItems": true,
              "items": { "$ref": "#/$defs/privateDomain" }
            }
          }
        },
        "sandbox": {
          "description": "No sandbox key is proposable in v1. The section is named rather than left to additionalProperties so preset, repo_dirs, inherit_env, allow_cache_exec, use_bubblewrap and agents_md are all refused by one rule. cplt does let a repo propose sandbox.pass_env; adding it here is a deliberate one-line change on the day nav-pilot implements it.",
          "type": "object",
          "additionalProperties": false,
          "properties": {}
        },
        "allow": {
          "description": "Read-only path grants. read is the only key here, and it is narrower than the private-domain waiver: cplt emits exactly one rule per entry, `(allow file-read* (subpath \"<path>\"))` on macOS and AccessFs::ReadFile|ReadDir on Linux, and ResolveUnix is granted only alongside a write, so a read grant cannot become a connect right. write, exec and socket are refused.",
          "type": "object",
          "additionalProperties": false,
          "properties": {
            "read": {
              "type": "array",
              "minItems": 1,
              "maxItems": 8,
              "uniqueItems": true,
              "items": { "$ref": "#/$defs/proposedReadPath" }
            }
          }
        },
        "deny": false,
        "gh_guard": false,
        "git_guard": false,
        "guards": false,
        "preset": false,
        "repo_dirs": false,
        "inherit_env": false,
        "allowed_domains": false,
        "blocked_domains": false
      }
    }
  },
  "properties": {
    "contractVersion": {
      "description": "Manifest schema-and-semantics version. nav-pilot supports major version 1.",
      "type": "string",
      "pattern": "^1(\\.\\d+)?$"
    },
    "name": {
      "description": "Agentpakke identity. Recorded as the install's collection name (the agentpakke manifest supersedes the collection manifest).",
      "$ref": "#/$defs/identifier"
    },
    "description": {
      "type": "string"
    },
    "owner": {
      "description": "Attribution only; the install source is wherever the manifest was cloned from.",
      "type": "object",
      "additionalProperties": true,
      "properties": {
        "repo": { "type": "string", "pattern": "^[^/]+/[^/]+$" },
        "team": { "type": "string" }
      }
    },
    "clients": {
      "description": "One entry per supported client (keys today: copilot, opencode, pi). Keys are pattern-validated, not enumerated: a consumer MUST ignore client keys it does not recognize — that client is unavailable, the manifest stays valid (A3/A4). Tier is derived from shape: an entry with `payloads` is Tier 2; an entry relying on the top-level `layout` is Tier 1 (A1).",
      "type": "object",
      "minProperties": 1,
      "propertyNames": { "$ref": "#/$defs/identifier" },
      "additionalProperties": {
        "type": "object",
        "additionalProperties": true,
        "properties": {
          "primaryAgents": {
            "description": "Agent names treated as primary personas for this client (C1-C2). Every other agent materializes as a subagent. Optional: a Tier 1 entry that ships no agent omits it, and nav-pilot then refuses to launch that client because there is no persona to hand it, while install and sync carry the pakke's other content as usual. Declaring it commits the pakke to a layout.agents directory holding a file per name. Ignored for a Tier 2 entry, where the roster belongs to each payload tree: see clients.<client>.payloads.<context>.primaryAgents.",
            "type": "array",
            "items": { "type": "string", "minLength": 1 },
            "minItems": 1
          },
          "compatibility": {
            "description": "Supported client version RANGE (A1); exact pins belong only to the local/security-profile tier (M4).",
            "type": "string"
          },
          "defaultModel": {
            "description": "Default model id, or the literal \"inherit\" (F3).",
            "type": "string"
          },
          "defaultContext": {
            "description": "Which payload context launches by default (G3); defaults to \"full\".",
            "$ref": "#/$defs/identifier"
          },
          "payloads": {
            "description": "Tier 2: one entry per context (keys today: full, focused) — same ignore-unknown rule as client keys. Each payload declares its own primaryAgents, because the payload tree is what carries the agents. Payload manifest is `<path>/manifest.json` by convention (A7); `manifest` only overrides that.",
            "type": "object",
            "minProperties": 1,
            "propertyNames": { "$ref": "#/$defs/identifier" },
            "additionalProperties": {
              "type": "object",
              "required": ["path", "primaryAgents"],
              "additionalProperties": true,
              "properties": {
                "path": { "$ref": "#/$defs/relativePath" },
                "manifest": { "$ref": "#/$defs/relativePath" },
                "primaryAgents": {
                  "description": "Agent names launchable in this context. The first element is the context's default persona. Required: a payload tree carries its own agents, so a context roster cannot be inferred from the client entry (C1-C2).",
                  "type": "array",
                  "items": { "type": "string", "minLength": 1 },
                  "minItems": 1
                }
              }
            }
          }
        }
      }
    },
    "layout": {
      "description": "Tier 1 clients only: repo-relative paths to content directories (D1). Declare the directories the pakke actually ships and no others: a skills-only or instructions-only pakke omits `agents`, and a pakke declaring primaryAgents must declare `agents`. At least one of the known directories must be named — unknown keys stay valid (A3/A4) but nav-pilot reads none of them, so a layout made only of those would materialize nothing.",
      "type": "object",
      "anyOf": [
        { "required": ["agents"] },
        { "required": ["skills"] },
        { "required": ["instructions"] },
        { "required": ["prompts"] },
        { "required": ["hooks"] },
        { "required": ["extensions"] }
      ],
      "additionalProperties": true,
      "properties": {
        "agents": { "$ref": "#/$defs/relativePath" },
        "skills": { "$ref": "#/$defs/relativePath" },
        "instructions": { "$ref": "#/$defs/relativePath" },
        "prompts": { "$ref": "#/$defs/relativePath" },
        "hooks": { "$ref": "#/$defs/relativePath" },
        "extensions": { "$ref": "#/$defs/relativePath" }
      }
    },
    "provenance": {
      "description": "For composed content (H2): base repo + digest, overlay components with versions.",
      "type": "object",
      "additionalProperties": true,
      "properties": {
        "base": {
          "type": "object",
          "required": ["repo", "digest"],
          "additionalProperties": true,
          "properties": {
            "repo": { "type": "string", "minLength": 1 },
            "digest": { "type": "string", "minLength": 1 }
          }
        },
        "overlays": {
          "type": "array",
          "items": {
            "type": "object",
            "required": ["component", "version"],
            "additionalProperties": true,
            "properties": {
              "component": { "type": "string", "minLength": 1 },
              "version": { "type": "string", "minLength": 1 }
            }
          }
        }
      }
    },
    "policies": {
      "description": "Optional pointers to policy artifacts materialized by nav-pilot for Tier 1 clients (E1), plus the sandbox configuration this agentpakke proposes to whoever installs it (propose).",
      "type": "object",
      "additionalProperties": true,
      "properties": {
        "opencodePermissions": { "$ref": "#/$defs/relativePath" },
        "propose": {
          "description": "Sandbox configuration this agentpakke asks the installing user to consent to, keyed by the tool it is expressed in and written in that tool's own vocabulary. A proposal configures nothing by itself: it becomes launch flags only after an interactive approval, and only for the scope that approved it. Tool keys this nav-pilot does not implement are ignored (A3/A4), so pi and opencode can be defined later without invalidating an existing manifest.",
          "type": "object",
          "additionalProperties": true,
          "properties": {
            "cplt": { "$ref": "#/$defs/cpltProposal" }
          }
        }
      }
    },
    "profiles": {
      "description": "Optional launch profiles: a directory of profile files plus the manifest-declared default (E2).",
      "type": "object",
      "additionalProperties": true,
      "properties": {
        "dir": { "$ref": "#/$defs/relativePath" },
        "default": { "type": "string" }
      }
    },
    "mcpServers": {
      "description": "MCP servers this agentpakke's agents and skills expect, named as they are in Nav's MCP registry. Every name must be one the registry publishes; nav-pilot asks the registry at validate and install time, and a name it does not publish is a violation. Declaring one does not configure it: nav-pilot writes no MCP configuration for any client, and enabling a server stays the user's action. install names what the pakke needs and points at the registry.",
      "type": "array",
      "uniqueItems": true,
      "items": { "$ref": "#/$defs/mcpServerName" }
    },
    "minNavPilotVersion": {
      "description": "Minimum nav-pilot version required, in the release format YYYY.MM.DD-HHMMSS-sha7 (the build sha is optional). A value outside this format is rejected rather than ignored: nav-pilot cannot compare it, so accepting it would silently disable the gate the manifest asked for.",
      "type": "string",
      "pattern": "^\\d{4}\\.\\d{2}\\.\\d{2}-\\d{6}(-[0-9a-zA-Z][0-9a-zA-Z.-]*)?$"
    }
  }
}
